{
  "$schema": "http://json-schema.org/draft-07/schema#",
  "$id": "https://github.com/riccarvalhinho/mtg-recall/data/schema/deck.schema.json",
  "title": "Deck",
  "description": "Um deck, num ficheiro por deck em data/decks/<id>.json. Existe para a mesma pergunta poder ser feita em vários eventos: 'com que deck é que eu ganho mais?'. Antes disto o deck era texto livre dentro do evento e não se reutilizava. As decisões estão em data-model.md.",
  "type": "object",
  "additionalProperties": false,
  "required": [
    "id",
    "name",
    "colors"
  ],
  "properties": {
    "id": {
      "description": "Slug único, igual ao nome do ficheiro sem extensão.",
      "type": "string",
      "pattern": "^[a-z0-9]+(-[a-z0-9]+)*$"
    },
    "name": {
      "description": "Como o deck aparece na app.",
      "type": "string",
      "minLength": 1
    },
    "colors": {
      "$ref": "#/definitions/manaSelection"
    },
    "format": {
      "description": "Formato para que o deck foi construído. A mesma lista dos eventos.",
      "type": "string",
      "enum": [
        "Sealed",
        "Draft",
        "Standard",
        "Modern",
        "Pioneer",
        "Legacy",
        "Commander"
      ]
    },
    "archetype": {
      "description": "Arquétipo, à mão (ex.: Izzet Prowess). Não é uma taxonomia: não há lista fechada de arquétipos que sobreviva a uma rotação.",
      "type": "string",
      "minLength": 1
    },
    "thumbnailCardId": {
      "description": "Scryfall id da carta que ilustra o deck. Fase 3.",
      "type": "string",
      "minLength": 1
    },
    "cards": {
      "description": "A lista de cartas. OPCIONAL de propósito: escrever 60 cartas no telemóvel é trabalho a sério, e um deck sem cartas já serve para saber com que deck se ganha mais. Sem isto, o Deck Analyser não aparece — o resto funciona na mesma.",
      "type": "array",
      "items": {
        "$ref": "#/definitions/deckCard"
      }
    },
    "notes": {
      "type": "string"
    }
  },
  "definitions": {
    "manaColor": {
      "type": "string",
      "enum": [
        "W",
        "U",
        "B",
        "R",
        "G"
      ]
    },
    "manaSelection": {
      "description": "Cores principais e cores de splash, separadas. Uma cor não pode estar nas duas.",
      "type": "object",
      "additionalProperties": false,
      "required": [
        "main",
        "splash"
      ],
      "properties": {
        "main": {
          "type": "array",
          "items": {
            "$ref": "#/definitions/manaColor"
          },
          "uniqueItems": true
        },
        "splash": {
          "type": "array",
          "items": {
            "$ref": "#/definitions/manaColor"
          },
          "uniqueItems": true
        }
      }
    },
    "deckCard": {
      "description": "Uma entrada da lista. Os campos vindos da Scryfall são copiados para aqui de propósito: os dados de uma impressão não mudam — o custo de mana de uma carta é o que é — e copiá-los deixa o Deck Analyser funcionar sem rede e sem cache, que é a regra 3 do projecto. O que muda com o tempo são os preços, e esses ficam de fora (Fase 4).",
      "type": "object",
      "additionalProperties": false,
      "required": [
        "name",
        "quantity"
      ],
      "properties": {
        "name": {
          "description": "Nome da carta, como aparece na Scryfall.",
          "type": "string",
          "minLength": 1
        },
        "quantity": {
          "type": "integer",
          "minimum": 1,
          "maximum": 99
        },
        "board": {
          "description": "Deck principal ou sideboard. Ausente significa main.",
          "type": "string",
          "enum": [
            "main",
            "side"
          ]
        },
        "scryfallId": {
          "description": "Id da carta na Scryfall. Ausente quando o nome foi escrito à mão.",
          "type": "string",
          "minLength": 1
        },
        "setCode": {
          "description": "Código do set da impressão, minúsculas. Serve o ícone do set ao lado do nome na decklist. Ausente numa carta escrita à mão, que não passou pela Scryfall.",
          "type": "string",
          "pattern": "^[a-z0-9]{3,6}$"
        },
        "rarity": {
          "description": "Raridade da impressão, como a Scryfall a dá. Colore o símbolo do set na decklist, que é a convenção das cartas a sério — o símbolo é um só, a cor é que diz a raridade.",
          "type": "string",
          "enum": [
            "common",
            "uncommon",
            "rare",
            "mythic",
            "special",
            "bonus"
          ]
        },
        "manaCost": {
          "description": "Custo de mana em notação Scryfall, ex.: {1}{U}{U}.",
          "type": "string"
        },
        "cmc": {
          "description": "Valor de mana. Alimenta a curva. Meio ponto existe por causa das cartas de Un-sets.",
          "type": "number",
          "minimum": 0
        },
        "typeLine": {
          "description": "Linha de tipo, ex.: Creature — Human Wizard. Alimenta a contagem por tipo.",
          "type": "string"
        },
        "colors": {
          "description": "Cores da carta em si, para a distribuição de cores.",
          "type": "array",
          "items": {
            "$ref": "#/definitions/manaColor"
          },
          "uniqueItems": true
        },
        "artCropUrl": {
          "description": "Recorte da arte na Scryfall, sem moldura nem texto — é o que a decklist mostra em cada linha. Ao contrário dos outros campos copiados, este NÃO é imutável: a Scryfall pode mudar onde aloja as imagens. Trata-se como pista, não como verdade — se não carregar, a linha volta ao placeholder.",
          "type": "string",
          "format": "uri"
        }
      }
    }
  }
}
