{
  "id": "pre-release-reality-fracture",
  "name": "Noncreature damage Rakdos Aggro",
  "colors": {
    "main": [
      "B",
      "R"
    ],
    "splash": []
  },
  "format": "Sealed",
  "archetype": "Noncreature damage - bard aggro",
  "thumbnailCardId": "4404d9d4-9cdd-4dad-a4f6-574d90db5052",
  "cards": [
    {
      "name": "Awaken the Inferno",
      "quantity": 1,
      "scryfallId": "c596c4ec-8480-4be9-a45d-700398a126f6",
      "setCode": "fra",
      "rarity": "common",
      "manaCost": "{4}{R}",
      "cmc": 5,
      "typeLine": "Sorcery",
      "colors": [
        "R"
      ],
      "artCropUrl": "https://cards.scryfall.io/art_crop/front/c/5/c596c4ec-8480-4be9-a45d-700398a126f6.jpg?1789556812"
    },
    {
      "name": "Break Under Pressure",
      "quantity": 1,
      "scryfallId": "46974d94-e900-43e4-92b5-4fb9b9f7cf46",
      "setCode": "fra",
      "rarity": "uncommon",
      "manaCost": "{2}{B}",
      "cmc": 3,
      "typeLine": "Instant",
      "colors": [
        "B"
      ],
      "artCropUrl": "https://cards.scryfall.io/art_crop/front/4/6/46974d94-e900-43e4-92b5-4fb9b9f7cf46.jpg?1789385622"
    },
    {
      "name": "Cast Away Doubt",
      "quantity": 1,
      "scryfallId": "3b5b28a4-0abd-4dc2-9856-c9a8d27f6a2d",
      "setCode": "fra",
      "rarity": "common",
      "manaCost": "{2}{B}",
      "cmc": 3,
      "typeLine": "Sorcery",
      "colors": [
        "B"
      ],
      "artCropUrl": "https://cards.scryfall.io/art_crop/front/3/b/3b5b28a4-0abd-4dc2-9856-c9a8d27f6a2d.jpg?1788353191"
    },
    {
      "name": "Charge the Sanctum",
      "quantity": 1,
      "scryfallId": "87b40df5-5c0a-41f5-a09c-a04f17066a91",
      "setCode": "fra",
      "rarity": "common",
      "manaCost": "{2}{R/W}",
      "cmc": 3,
      "typeLine": "Instant",
      "colors": [
        "W",
        "R"
      ],
      "artCropUrl": "https://cards.scryfall.io/art_crop/front/8/7/87b40df5-5c0a-41f5-a09c-a04f17066a91.jpg?1788521570"
    },
    {
      "name": "Danitha, Spear of Agony",
      "quantity": 1,
      "scryfallId": "6489814b-3d10-423e-988c-324740d36748",
      "setCode": "fra",
      "rarity": "uncommon",
      "manaCost": "{2}{B}",
      "cmc": 3,
      "typeLine": "Legendary Creature — Human Knight",
      "colors": [
        "B"
      ],
      "artCropUrl": "https://cards.scryfall.io/art_crop/front/6/4/6489814b-3d10-423e-988c-324740d36748.jpg?1789127194"
    },
    {
      "name": "Extended Absence",
      "quantity": 1,
      "scryfallId": "eb4b6ed8-782e-4473-abc9-d50bf2275c6a",
      "setCode": "fra",
      "rarity": "common",
      "manaCost": "{3}{B}",
      "cmc": 4,
      "typeLine": "Instant",
      "colors": [
        "B"
      ],
      "artCropUrl": "https://cards.scryfall.io/art_crop/front/e/b/eb4b6ed8-782e-4473-abc9-d50bf2275c6a.jpg?1789556713"
    },
    {
      "name": "Grim Repriser",
      "quantity": 1,
      "scryfallId": "8295c48c-b4dd-4bc1-a206-04cf12b79bbd",
      "setCode": "fra",
      "rarity": "uncommon",
      "manaCost": "{B}{R}",
      "cmc": 2,
      "typeLine": "Creature — Zombie Bard",
      "colors": [
        "B",
        "R"
      ],
      "artCropUrl": "https://cards.scryfall.io/art_crop/front/8/2/8295c48c-b4dd-4bc1-a206-04cf12b79bbd.jpg?1789470746"
    },
    {
      "name": "Hallway Heckler // Vicious Verse",
      "quantity": 1,
      "scryfallId": "7e324816-552f-455d-97c4-5ea6b26d2e6e",
      "setCode": "fra",
      "rarity": "common",
      "manaCost": "{2}{R} // {B/R}",
      "cmc": 3,
      "typeLine": "Creature — Elemental Sorcerer // Sorcery",
      "colors": [
        "R"
      ],
      "artCropUrl": "https://cards.scryfall.io/art_crop/front/7/e/7e324816-552f-455d-97c4-5ea6b26d2e6e.jpg?1789127576"
    },
    {
      "name": "Heartstring Puller",
      "quantity": 1,
      "scryfallId": "cbfe3354-7ced-4773-9a4e-a937ae9f94f8",
      "setCode": "fra",
      "rarity": "common",
      "manaCost": "{3}{R}",
      "cmc": 4,
      "typeLine": "Creature — Elf Sorcerer",
      "colors": [
        "R"
      ],
      "artCropUrl": "https://cards.scryfall.io/art_crop/front/c/b/cbfe3354-7ced-4773-9a4e-a937ae9f94f8.jpg?1789556808"
    },
    {
      "name": "Last Gasp",
      "quantity": 1,
      "scryfallId": "6d9c8d6b-b49f-4777-baa3-6381a624e3c6",
      "setCode": "trc",
      "rarity": "common",
      "manaCost": "{1}{B}",
      "cmc": 2,
      "typeLine": "Instant",
      "colors": [
        "B"
      ],
      "artCropUrl": "https://cards.scryfall.io/art_crop/front/6/d/6d9c8d6b-b49f-4777-baa3-6381a624e3c6.jpg?1785981178"
    },
    {
      "name": "Mabel, Bitter Recluse",
      "quantity": 1,
      "scryfallId": "b2a412b0-2ae4-4552-bc5e-70654b6b9b4e",
      "setCode": "fra",
      "rarity": "uncommon",
      "manaCost": "{B}",
      "cmc": 1,
      "typeLine": "Legendary Creature — Mouse Warlock",
      "colors": [
        "B"
      ],
      "artCropUrl": "https://cards.scryfall.io/art_crop/front/b/2/b2a412b0-2ae4-4552-bc5e-70654b6b9b4e.jpg?1789385677"
    },
    {
      "name": "Master of Barbs",
      "quantity": 1,
      "scryfallId": "4404d9d4-9cdd-4dad-a4f6-574d90db5052",
      "setCode": "fra",
      "rarity": "rare",
      "manaCost": "{1}{R}",
      "cmc": 2,
      "typeLine": "Creature — Lizard Bard",
      "colors": [
        "R"
      ],
      "artCropUrl": "https://cards.scryfall.io/art_crop/front/4/4/4404d9d4-9cdd-4dad-a4f6-574d90db5052.jpg?1789127596"
    },
    {
      "name": "Mountain",
      "quantity": 8,
      "typeLine": "Basic Land — Mountain"
    },
    {
      "name": "No Admittance",
      "quantity": 1,
      "scryfallId": "11ba4fdd-cc03-4bb6-a493-91a9785771d0",
      "setCode": "fra",
      "rarity": "common",
      "manaCost": "{1}{R}",
      "cmc": 2,
      "typeLine": "Sorcery",
      "colors": [
        "R"
      ],
      "artCropUrl": "https://cards.scryfall.io/art_crop/front/1/1/11ba4fdd-cc03-4bb6-a493-91a9785771d0.jpg?1788878170"
    },
    {
      "name": "Proft, Sinister Mastermind",
      "quantity": 2,
      "scryfallId": "d36b0e06-cb82-4c48-bf35-e76f109116f6",
      "setCode": "fra",
      "rarity": "uncommon",
      "manaCost": "{2}{B}",
      "cmc": 3,
      "typeLine": "Legendary Creature — Human Rogue",
      "colors": [
        "B"
      ],
      "artCropUrl": "https://cards.scryfall.io/art_crop/front/d/3/d36b0e06-cb82-4c48-bf35-e76f109116f6.jpg?1789127196"
    },
    {
      "name": "Rank Rat",
      "quantity": 1,
      "scryfallId": "4ff6da82-d7dd-4b59-b7e6-30670cea7169",
      "setCode": "fra",
      "rarity": "common",
      "manaCost": "{1}{B}",
      "cmc": 2,
      "typeLine": "Creature — Zombie Rat",
      "colors": [
        "B"
      ],
      "artCropUrl": "https://cards.scryfall.io/art_crop/front/4/f/4ff6da82-d7dd-4b59-b7e6-30670cea7169.jpg?1789556727"
    },
    {
      "name": "Skilled Battlecarver",
      "quantity": 1,
      "scryfallId": "0e44f959-1322-4abd-b6eb-dea992307c0c",
      "setCode": "fra",
      "rarity": "common",
      "manaCost": "{1}{R}",
      "cmc": 2,
      "typeLine": "Creature — Human Warrior",
      "colors": [
        "R"
      ],
      "artCropUrl": "https://cards.scryfall.io/art_crop/front/0/e/0e44f959-1322-4abd-b6eb-dea992307c0c.jpg?1789556811"
    },
    {
      "name": "Solve for Disappointment",
      "quantity": 1,
      "scryfallId": "7beaa8c9-1a2c-4c88-b579-91e371d8d9e3",
      "setCode": "fra",
      "rarity": "common",
      "manaCost": "{1}{B}",
      "cmc": 2,
      "typeLine": "Sorcery",
      "colors": [
        "B"
      ],
      "artCropUrl": "https://cards.scryfall.io/art_crop/front/7/b/7beaa8c9-1a2c-4c88-b579-91e371d8d9e3.jpg?1788878155"
    },
    {
      "name": "Stinging Vitriol",
      "quantity": 1,
      "scryfallId": "a7d78297-7411-4ec5-8931-a25146869d5b",
      "setCode": "fra",
      "rarity": "rare",
      "manaCost": "{B}{R}",
      "cmc": 2,
      "typeLine": "Sorcery",
      "colors": [
        "B",
        "R"
      ],
      "artCropUrl": "https://cards.scryfall.io/art_crop/front/a/7/a7d78297-7411-4ec5-8931-a25146869d5b.jpg?1789385971"
    },
    {
      "name": "Swamp",
      "quantity": 8,
      "typeLine": "Basic Land — Swamp"
    },
    {
      "name": "Theoretical Necromancer",
      "quantity": 1,
      "scryfallId": "e36a7908-1e22-494b-adb4-e72ac0974d62",
      "setCode": "fra",
      "rarity": "common",
      "manaCost": "{2}{B}",
      "cmc": 3,
      "typeLine": "Creature — Vampire Warlock",
      "colors": [
        "B"
      ],
      "artCropUrl": "https://cards.scryfall.io/art_crop/front/e/3/e36a7908-1e22-494b-adb4-e72ac0974d62.jpg?1789556734"
    },
    {
      "name": "Violent Echoes",
      "quantity": 1,
      "scryfallId": "ad03ba90-2442-4a71-94df-2088b5b63662",
      "setCode": "fra",
      "rarity": "uncommon",
      "manaCost": "{2}{R}{R}",
      "cmc": 4,
      "typeLine": "Instant",
      "colors": [
        "R"
      ],
      "artCropUrl": "https://cards.scryfall.io/art_crop/front/a/d/ad03ba90-2442-4a71-94df-2088b5b63662.jpg?1789127599"
    },
    {
      "name": "Way of the Warlord",
      "quantity": 2,
      "scryfallId": "6d86e410-20c4-4248-96bf-5780ece6274a",
      "setCode": "fra",
      "rarity": "uncommon",
      "manaCost": "{2}{R}",
      "cmc": 3,
      "typeLine": "Legendary Enchantment",
      "colors": [
        "R"
      ],
      "artCropUrl": "https://cards.scryfall.io/art_crop/front/6/d/6d86e410-20c4-4248-96bf-5780ece6274a.jpg?1789729585"
    },
    {
      "name": "Whiplash Wordsmith // Vicious Verse",
      "quantity": 1,
      "scryfallId": "8096bc9a-a610-448f-bef2-7230e17e9777",
      "setCode": "fra",
      "rarity": "common",
      "manaCost": "{3}{B/R} // {B/R}",
      "cmc": 4,
      "typeLine": "Creature — Vampire Sorcerer // Sorcery",
      "colors": [
        "B",
        "R"
      ],
      "artCropUrl": "https://cards.scryfall.io/art_crop/front/8/0/8096bc9a-a610-448f-bef2-7230e17e9777.jpg?1789127692"
    }
  ]
}
